{
  "review_contract_version": "quant_theme_rotation_20260927",
  "schema_version": "2.0.0",
  "model_version": "V2.0",
  "stage": "final_review",
  "input_stage": "21:30_quantitative_review_payload",
  "trade_date": "20260928",
  "next_trade_date": "20260929",
  "evidence_cutoff": "2026-09-28T18:39:21+08:00",
  "future_data_rows_used": 0,
  "input_sha256": "624002f09d2c16c04ccba17bef25c30c3dc1976c56630ca7a5bde5d3d359640c",
  "attempt_no": 0,
  "market_context": {
    "reported_facts": [],
    "analysis_inferences": [
      "权威量化包显示上涨898家、下跌4554家，上涨占比16.16%，市场中位数单日收益-1.85%。",
      "上证、深证成指和创业板指均为下跌趋势且低于各自20日均线；本次按防守口径压缩正式短名单。",
      "池内题材行情覆盖完整，但没有题材达到上游linked条件，不能仅凭静态标签宣称题材联动或升温。",
      "RSI仅用于识别偏高与回落风险，不单独作为顶底或买卖结论。"
    ],
    "missing": [
      "未取得截止时间前可核验的独立公开收评，因此市场数字仅作为已校验量化输入的分析背景，不列作外部报道事实。",
      "缺少可比的前一交易日题材聚合快照，无法正式报告题材升温或降温。",
      "国邦医药及池外候选缺少本次bundle题材分类，不据此虚构联动。"
    ],
    "decision": "市场处于退潮和防守阶段，官方池仅保留上游前5名为研究短名单，其余观察或暂缓；池外本次不设正式短名单。该结果不是交易指令。"
  },
  "official_candidates": [
    {
      "ts_code": "001211.SZ",
      "name": "双枪科技",
      "origin": "official_pool",
      "selection_order": 1,
      "quant_score": 40.864379,
      "quant_rank": 1,
      "technical_score": 27.605163,
      "input_snapshot": {
        "amount_ratio_1d_20d": 2.043984282567782,
        "atr14_pct": 5.535779720462754,
        "candidate_source": {
          "as_of": "20260928",
          "breakout_date_5session_window": "20260921",
          "breakout_level": 25.88,
          "breakout_window_scope": "recent_5_session_observation_only",
          "downside_relative_5d": 0.03310415434418549,
          "early_signal_validity": "valid",
          "early_signal_validity_reason": "close_above_original_20_session_breakout_level",
          "entry_signal": false,
          "event_theme_ids": [],
          "extension_priority": {
            "components": {
              "distance_ma20_atr": 0.6289519306540584,
              "gain_5d": 0.36321483771251994,
              "longest_up_run_5d": 0.2
            },
            "distance_ma20_atr": 1.8868557919621753,
            "extension_priority_demoted": false,
            "extension_score": 0.4154191108139284,
            "gain_5d_pct": 5.448222565687799,
            "longest_up_run_5d": 1,
            "state": "complete"
          },
          "final_score_effect": 0,
          "historical_trigger_basis": "close_above_prior_20_session_high_and_volume_ratio_ge_1.2",
          "relative_return_3d": 0.0989482015841795,
          "routes": [
            "early_leader"
          ],
          "selection_priority_reason": "route_or_quant_fallback",
          "theme_ids": [
            "家居消费"
          ],
          "timing_guard_reason": "v2_guard_definition_missing",
          "timing_guard_triggered": null,
          "version": "v2_candidate_sources_20260927_longest_run_experiment",
          "volume_ratio": 1.6130855652551805
        },
        "close": 27.29,
        "close_location": 0.6498054474708164,
        "close_vs_vwap_pct": 1.315840532197865,
        "data_complete": true,
        "distance_ma20_atr": 1.8868557919621753,
        "final_review_pending": true,
        "kdj_as_of": "20260928",
        "kdj_cross_age_days": 7,
        "kdj_cross_state": "none",
        "kdj_d": 70.74038427908899,
        "kdj_d_prev": 67.46608088774204,
        "kdj_d_slope_3d": 10.724490844081444,
        "kdj_data_complete": true,
        "kdj_j": 90.38620462717077,
        "kdj_j_prev": 85.10882518540564,
        "kdj_j_slope_3d": 0.5716724745280715,
        "kdj_k": 77.28899106178291,
        "kdj_k_prev": 73.3469956536299,
        "kdj_k_slope_3d": 7.34021805423032,
        "kdj_source": "stock_key10_v2_scoring.build_stock_features:history_ohlc",
        "market_fit_score": 4.964286,
        "momentum_relative_strength_score": 4.982143,
        "name": "双枪科技",
        "origin": "official_pool",
        "quant_rank": 1,
        "quant_score": 40.864379,
        "return_10d_pct": 19.11828895678742,
        "return_1d_pct": 6.2695,
        "return_20d_pct": 16.47460520699957,
        "return_5d_pct": 5.448222565687799,
        "risk_annotations": [],
        "risk_rank_effect": false,
        "risk_score_effect": 0,
        "rsi14": 62.81833616298812,
        "sector": "家居用品",
        "sector_rank": 20,
        "sector_score": 8.29493,
        "segment": "深市主板",
        "selection_order": 1,
        "setup_type": "trend_continuation",
        "stage_pattern_score": 8.0,
        "structure_health_score": 2.5,
        "technical_completeness": 1.0,
        "technical_score": 27.605163,
        "theme_classification": {
          "business_realization": "待核验",
          "business_verification_status": "not_independently_verified_by_this_import",
          "classification_status": "user_confirmed",
          "classification_version": "2.0",
          "effective_from": null,
          "fact_summary": "餐厨具主业；上涨驱动待确认",
          "imported_at": "2026-09-20T23:54:12+08:00",
          "observed_at": null,
          "primary_theme": "家居消费",
          "rules_version": "1.2",
          "source_blob_sha": "fafa071ae49e54e34e32a6f2f7313caf5e797fd8",
          "source_commit": "7828d38c41b06a4caaea5f04beeb0210cb08aec5",
          "source_path": "theme_assets/stock_theme_tags_229_v2.0.json",
          "source_published_at": null,
          "usage_scope": "classification_only_not_recall_membership"
        },
        "trade_date": "20260928",
        "trend_structure_score": 6.5,
        "ts_code": "001211.SZ",
        "volume_price_score": 5.62302,
        "volume_ratio_1d_prior_10d": 1.6130855652551805
      },
      "selection_status": "selected",
      "final_order": 1,
      "reason": "保留上游第1位；量化分40.86、技术分27.61。先行信号有效，但仅作为相对强度依据。",
      "risk_notes": [
        "跟随/时机护栏未启用，Unknown不视为低风险"
      ],
      "next_day_action": "仅列为次日重点观察；等待市场止跌、成交承接和个股不追高条件同时确认。",
      "reorder": null
    },
    {
      "ts_code": "300207.SZ",
      "name": "欣旺达",
      "origin": "official_pool",
      "selection_order": 2,
      "quant_score": 37.054493,
      "quant_rank": 7,
      "technical_score": 27.354472,
      "input_snapshot": {
        "amount_ratio_1d_20d": 2.353284309523898,
        "atr14_pct": 5.06147267138848,
        "candidate_source": {
          "as_of": "20260928",
          "breakout_date_5session_window": "20260928",
          "breakout_level": 20.88,
          "breakout_window_scope": "recent_5_session_observation_only",
          "downside_relative_5d": 0.04622821146224987,
          "early_signal_validity": "valid",
          "early_signal_validity_reason": "close_above_original_20_session_breakout_level",
          "entry_signal": false,
          "event_theme_ids": [
            "锂电池"
          ],
          "extension_priority": {
            "components": {
              "distance_ma20_atr": 0.8923652365236521,
              "gain_5d": 0.44932601098352326,
              "longest_up_run_5d": 0.6
            },
            "distance_ma20_atr": 2.677095709570956,
            "extension_priority_demoted": false,
            "extension_score": 0.6420582371766874,
            "gain_5d_pct": 6.739890164752849,
            "longest_up_run_5d": 3,
            "state": "complete"
          },
          "final_score_effect": 0,
          "historical_trigger_basis": "close_above_prior_20_session_high_and_volume_ratio_ge_1.2",
          "relative_return_3d": 0.14143716333175005,
          "routes": [
            "early_leader"
          ],
          "selection_priority_reason": "route_or_quant_fallback",
          "theme_ids": [
            "锂电池"
          ],
          "timing_guard_reason": "v2_guard_definition_missing",
          "timing_guard_triggered": null,
          "version": "v2_candidate_sources_20260927_longest_run_experiment",
          "volume_ratio": 1.6109683902604204
        },
        "close": 21.38,
        "close_location": 0.9878048780487807,
        "close_vs_vwap_pct": 1.9047813489653231,
        "data_complete": true,
        "distance_ma20_atr": 2.677095709570956,
        "final_review_pending": true,
        "kdj_as_of": "20260928",
        "kdj_cross_age_days": 1,
        "kdj_cross_state": "none",
        "kdj_d": 71.36857965830104,
        "kdj_d_prev": 67.33427877887881,
        "kdj_d_slope_3d": 4.6676930953219795,
        "kdj_data_complete": true,
        "kdj_j": 95.57438493483446,
        "kdj_j_prev": 73.55063851864529,
        "kdj_j_slope_3d": 29.528453297484873,
        "kdj_k": 79.43718141714551,
        "kdj_k_prev": 69.4063986921343,
        "kdj_k_slope_3d": 12.954613162709606,
        "kdj_source": "stock_key10_v2_scoring.build_stock_features:history_ohlc",
        "market_fit_score": 4.933333,
        "momentum_relative_strength_score": 4.4,
        "name": "欣旺达",
        "origin": "official_pool",
        "quant_rank": 7,
        "quant_score": 37.054493,
        "return_10d_pct": 15.755278830536001,
        "return_1d_pct": 6.4211,
        "return_20d_pct": 19.241494701617402,
        "return_5d_pct": 6.739890164752849,
        "risk_annotations": [],
        "risk_rank_effect": false,
        "risk_score_effect": 0,
        "rsi14": 77.86561264822134,
        "sector": "电气设备",
        "sector_rank": 83,
        "sector_score": 4.766688,
        "segment": "创业板",
        "selection_order": 2,
        "setup_type": "trend_continuation",
        "stage_pattern_score": 7.25,
        "structure_health_score": 2.5,
        "technical_completeness": 1.0,
        "technical_score": 27.354472,
        "theme_classification": {
          "business_realization": "已有收入（据材料）",
          "business_verification_status": "not_independently_verified_by_this_import",
          "classification_status": "user_confirmed",
          "classification_version": "2.0",
          "effective_from": null,
          "fact_summary": "动力、储能、消费；AIDC订单增长不等于收入增长",
          "imported_at": "2026-09-20T23:54:12+08:00",
          "observed_at": null,
          "primary_theme": "锂电池",